{
  "$schema": "https://json-schema.org/draft/2020-12/schema",
  "$id": "https://github.com/DEFRA/trade-imports-schemas/blob/main/schemas/imports/event-envelope-v1.schema.json",
  "title": "Trade Imports Event Envelope",
  "description": "Event envelope for Trade Imports CDP Microservice Architecture",

  "type": "object",
  "required": [
    "eventId",
    "aggregateType",
    "subType",
    "aggregateId",
    "aggregateVersion",
    "eventType",
    "timestamp",
    "data",
    "metadata"
  ],
  "additionalProperties": false,
  "properties": {
    "$schema": {
      "type": "string",
      "description": "Sample-validator hook: relative path to the event schema. Present on sample artefacts; not part of the runtime event payload."
    },
    "eventId": {
      "type": "string",
      "format": "uuid",
      "description": "Unique identifier for deduplication, tracing, and replay"
    },
    "aggregateType": {
      "type": "string",
      "description": "Type of aggregate  (e.g., Notification, Export)"
    },
    "subType": {
      "type": "string",
      "description": "Discriminator for aggregate sub-types (e.g., IMP, CVEDA)"
    },
    "aggregateId": {
      "type": "string",
      "description": "Unique identifier for the aggregate instance (compound key format varies by aggregate type)"
    },
    "aggregateVersion": {
      "type": "integer",
      "minimum": 1,
      "description": "Monotonic version for ordering events within an aggregate instance"
    },
    "eventType": {
      "type": "string",
      "description": "Fully-qualified event type name (e.g., uk.gov.defra.imports.notification.NotificationCreated)"
    },
    "timestamp": {
      "type": "string",
      "format": "date-time",
      "description": "ISO 8601 UTC time the business event occurred (YYYY-MM-DDTHH:mm:ss.sssZ milliseconds precision)"
    },
    "data": {
      "type": "object",
      "description": "Event-specific payload (structure defined by individual event schemas)"
    },
    "metadata": {
      "type": "object",
      "required": [
        "schemaVersion",
        "schemaUri"
      ],
      "additionalProperties": false,
      "properties": {
        "correlationId": {
          "type": "string",
          "description": "Correlation identifier propagated from the request boundary"
        },
        "schemaVersion": {
          "type": "string",
          "description": "Structural schema version for this event type. Semver-style `MAJOR.MINOR.PATCH`, e.g. `1.0.0`."
        },
        "schemaUri": {
          "type": "string",
          "format": "uri",
          "description": "Reference to the governing event schema definition (e.g., event-submitted-v1.schema.json for live animals submitted, plants-event-submitted-v1.schema.json for plants)"
        }
      }
    },
    "actor": {
      "$ref": "#/$defs/actor",
      "description": "The user or service that triggered this event. Sourced from the acting user's identity at the time the event was written to the outbox."
    },
    "statusChanges": {
      "type": "array",
      "description": "Ordered history of status transitions for this aggregate up to and including the current event. Each entry records the status, the instant it changed, and the actor responsible.",
      "items": {
        "type": "object",
        "properties": {
          "status":      { "type": "string" },
          "dateChanged": { "type": "string", "format": "date-time" },
          "actor":       { "$ref": "#/$defs/actor" }
        }
      }
    }
  },

  "$defs": {
    "actor": {
      "type": "object",
      "description": "The user or service that triggered an event.",
      "properties": {
        "id":                       { "type": "string" },
        "source":                   { "type": "string" },
        "userType":                 { "type": "string" },
        "displayName":              { "type": "string" },
        "organisationId":           { "type": "string" },
        "onBehalfOfOrganisationId": { "type": "string" }
      }
    }
  }
}
