{
  "$schema": "gbn-ag-event-notification-created-v1.schema.json",
  "eventId": "a1b2c3d4-e5f6-7890-abcd-ef1234567000",
  "aggregateType": "Notification",
  "subType": "GBN-AG",
  "aggregateId": "Imports.Notification.GBN-AG.GBN-AG-26-0000001",
  "aggregateVersion": 1,
  "eventType": "uk.gov.defra.imports.notification.NotificationCreated",
  "timestamp": "2026-05-15T09:30:00.000Z",
  "data": {
    "$model": "defra/certificate-internal/1",
    "$type": "gbn-ag",
    "exchangedDocument": {
      "identifier": "GBN-AG-26-0000001-8",
      "traderAssignedId": "Imports456_GB",
      "notificationStatusCode": "DRAFT",
      "issueDateTime": "2026-05-15T09:30:00.000Z",
      "issuer": {
        "name": "Kai Inc.",
        "postalAddress": {
          "lineOne": "UNCANNY COMICS",
          "lineTwo": "3 TARRING ROAD",
          "cityName": "WORTHING",
          "postcodeCode": "BN11 4SS",
          "countryId": "GB"
        },
        "definedContact": [
          {
            "personName": "Kai Atkinson",
            "emailURIUniversalCommunication": "kaiatkinson@jourrapide.com",
            "telephoneUniversalCommunication": "0123456788"
          }
        ]
      }
    },
    "specifiedConsignment": {
        "originCountry": {
          "code": { "value": "ES" }
        },
        "includedConsignmentItem": [
          {
            "includedTradeLineItem": [
              {
                "applicableClassification": [
                  {
                    "systemId": "CN",
                    "classCode": { "value": "01012100", "urlId": "https://traces-codelists.ec.europa.eu/cn" }
                  }
                ],
                "typeCode": "LIVE_ANIMAL",
                "urlId": "https://refdata.tbc.defra.gov.uk/species_type"
              }
            ]
          }
        ]
      }
  },
  "metadata": {
    "correlationId": "cid-20260515-093000",
    "schemaVersion": "1.0.0",
    "schemaUri": "https://github.com/DEFRA/trade-imports-schemas/blob/main/schemas/profiles/imports/gb/events/gbn-ag-event-notification-created-v1.schema.json"
  }
}